{
  "identity": {
    "id": "dulemon",
    "name": "DuLeMon",
    "repo": null,
    "docs": "https://arxiv.org/abs/2203.05797",
    "license": null,
    "version_or_commit": null,
    "observed_at": "2026-09-19"
  },
  "claimed_purpose": [
    {
      "text": "The benchmark targets long-term dialogue consistency and engagingness in open-domain human-bot conversations."
    }
  ],
  "mechanisms": [
    {
      "text": "Bot utterances in the conversation are annotated with the persona statement they ground to, indicated by an inline tab-separated label (e.g., U1, U2, B2)."
    }
  ],
  "ledger": [
    {
      "claim": "DuLeMon evaluates long-term dialogue consistency and dialogue engagingness as primary dimensions.",
      "kind": "paper",
      "url": "https://aclanthology.org/2022.findings-acl.207/",
      "quote": "Results on DuLeMon indicate that PLATO-LTM can significantly outperform baselines in terms of long-term dialogue consistency, leading to better dialogue engagingness.",
      "locator": "abstract, https://aclanthology.org/2022.findings-acl.207/",
      "confidence": "medium",
      "label": "inferred"
    },
    {
      "claim": "DuLeMon is the dataset name, standing for Baidu Long-term Memory Conversation.",
      "kind": "docs",
      "url": "https://github.com/PaddlePaddle/Research/blob/master/NLP/ACL2022-DuLeMon/README.md",
      "quote": "Bai du L ong-t e rm M emory C on versation",
      "locator": "README.md, Dataset: DuLeMon",
      "confidence": "high",
      "label": "measured"
    },
    {
      "claim": "The dataset is downloadable via a shell script at ./data/download_dulemon.sh.",
      "kind": "docs",
      "url": "https://github.com/PaddlePaddle/Research/blob/master/NLP/ACL2022-DuLeMon/README.md",
      "quote": "cd ./data\nbash download_dulemon.sh",
      "locator": "README.md, Dataset: DuLeMon \u2014 Download",
      "confidence": "high",
      "label": "measured"
    },
    {
      "claim": "The primary evaluation metrics include long-term dialogue consistency and dialogue engagingness.",
      "kind": "docs",
      "url": "https://github.com/PaddlePaddle/Research/blob/master/NLP/ACL2022-DuLeMon/README.md",
      "quote": "PLATO-LTM can significantly outperform baselines in terms of long-term dialogue consistency, leading to better dialogue engagingness",
      "locator": "README.md, Abstract",
      "confidence": "medium",
      "label": "inferred"
    },
    {
      "claim": "The dataset is associated with Findings of ACL 2022.",
      "kind": "docs",
      "url": "https://github.com/PaddlePaddle/Research/blob/master/NLP/ACL2022-DuLeMon/README.md",
      "quote": "Findings of ACL 2022 (Long Paper)",
      "locator": "README.md, title section",
      "confidence": "high",
      "label": "measured"
    },
    {
      "claim": "The conversation format includes persona-grounded utterance annotations linking bot/user turns to specific persona statement IDs.",
      "kind": "docs",
      "url": "https://github.com/PaddlePaddle/Research/blob/master/NLP/ACL2022-DuLeMon/README.md",
      "quote": "\"Bot: \u55ef\u55ef \uff0c \u770b\u8d77\u6765 \u662f \u633a \u8f7b\u677e \u7684 \u3002 \u4f60 \u8fd8\u5728 \u56fe\u4e66\u9986 \u91cc \u6253\u5de5 \u5462 \u3002\\tU1\"",
      "locator": "README.md, Dataset: DuLeMon \u2014 example JSON",
      "confidence": "high",
      "label": "measured"
    },
    {
      "claim": "The PLATO-LTM framework code was listed as coming soon at time of publication.",
      "kind": "docs",
      "url": "https://github.com/PaddlePaddle/Research/blob/master/NLP/ACL2022-DuLeMon/README.md",
      "quote": "Framework: PLATO-LTM ... Coming soon.",
      "locator": "README.md, Framework: PLATO-LTM",
      "confidence": "high",
      "label": "measured"
    },
    {
      "claim": "The dataset distinguishes between persona facts the user has already revealed in-session (user_said_persona) and facts not yet disclosed (user_no_said_persona), supporting evaluation of proactive persona elicitation.",
      "kind": "docs",
      "url": "https://github.com/PaddlePaddle/Research/blob/master/NLP/ACL2022-DuLeMon/README.md",
      "quote": "\"user_said_persona\": [...], \"user_no_said_persona\": [\"U6: \u6211 \u5728 \u4e0a \u5927\u5b66\"]",
      "locator": "README.md, Dataset Example JSON",
      "confidence": "high",
      "label": "inferred"
    },
    {
      "claim": "The dataset is named after its origin: Baidu Long-term Memory Conversation.",
      "kind": "docs",
      "url": "https://github.com/PaddlePaddle/Research/blob/master/NLP/ACL2022-DuLeMon/README.md",
      "quote": "Bai du L ong-t e rm M emory C on versation",
      "locator": "README.md, Dataset section header",
      "confidence": "high",
      "label": "inferred"
    },
    {
      "claim": "The evaluation framework PLATO-LTM was listed as 'coming soon' at time of page capture; scoring code is not yet available in the repository.",
      "kind": "docs",
      "url": "https://github.com/PaddlePaddle/Research/blob/master/NLP/ACL2022-DuLeMon/README.md",
      "quote": "Coming soon.",
      "locator": "README.md, Framework: PLATO-LTM section",
      "confidence": "high",
      "label": "inferred"
    },
    {
      "claim": "Long-term dialogue consistency is a primary evaluation dimension used on DuLeMon.",
      "kind": "paper",
      "url": "https://arxiv.org/abs/2203.05797",
      "quote": "Results on DuLeMon indicate that PLATO-LTM can significantly outperform baselines in terms of long-term dialogue consistency",
      "locator": "abstract",
      "confidence": "high",
      "label": "inferred"
    },
    {
      "claim": "The paper was accepted at Findings of ACL 2022.",
      "kind": "paper",
      "url": "https://arxiv.org/abs/2203.05797",
      "quote": "Accepted by Findings of ACL 2022 (Camera-ready version)",
      "locator": "comments",
      "confidence": "high",
      "label": "inferred"
    }
  ],
  "sources": [
    {
      "url": "https://arxiv.org/abs/2203.05797",
      "kind": "paper",
      "accessed_at": "2026-09-19",
      "quality": "high"
    },
    {
      "url": "https://aclanthology.org/2022.findings-acl.207/",
      "kind": "paper",
      "accessed_at": "2026-09-19",
      "quality": "high"
    },
    {
      "url": "https://github.com/PaddlePaddle/Research/tree/master/NLP/ACL2022-DuLeMon",
      "kind": "docs",
      "accessed_at": "2026-09-19",
      "quality": "high"
    },
    {
      "url": "https://github.com/PaddlePaddle/Research/blob/master/NLP/ACL2022-DuLeMon/README.md",
      "kind": "docs",
      "accessed_at": "2026-09-19",
      "quality": "high"
    }
  ],
  "consensus": [],
  "contested": [],
  "copy": [],
  "refuse": [],
  "unknowns": [
    {
      "text": "Dataset construction details not available from this page: synthetic vs. human-collected, annotation procedure, number of dialogues/turns, and train/test splits.",
      "url": "https://aclanthology.org/2022.findings-acl.207/pdf",
      "kind": "paper"
    },
    {
      "text": "Grader/scorer details not available from this page: whether long-term dialogue consistency and engagingness are measured via automatic metrics, human evaluation rubrics, or LLM-as-judge prompts.",
      "url": "https://aclanthology.org/2022.findings-acl.207/pdf",
      "kind": "paper"
    },
    {
      "text": "No repository or public release URL for DuLeMon is mentioned on this page.",
      "url": "https://aclanthology.org/2022.findings-acl.207/",
      "kind": "paper"
    },
    {
      "text": "Evaluation script or code path implementing scoring is listed as coming soon and not available on this page.",
      "url": "https://github.com/PaddlePaddle/Research/blob/master/NLP/ACL2022-DuLeMon/README.md",
      "kind": "docs"
    },
    {
      "text": "Evaluation script or code paths implementing scoring are not present; the framework code section is marked 'coming soon'.",
      "url": "https://github.com/PaddlePaddle/Research/blob/master/NLP/ACL2022-DuLeMon/README.md",
      "kind": "docs"
    },
    {
      "text": "Dataset construction details: whether DuLeMon is synthetic, human-annotated, or adversarially constructed; number of sessions, turns, or splits (train/dev/test) are not specified in the abstract.",
      "url": "https://arxiv.org/abs/2203.05797",
      "kind": "paper"
    },
    {
      "text": "Grader/scorer details: exact match, LLM-as-judge, human evaluation rubric, or metric formulas for long-term dialogue consistency and engagingness are not defined in the abstract.",
      "url": "https://arxiv.org/abs/2203.05797",
      "kind": "paper"
    },
    {
      "text": "No repository or release URL for the DuLeMon dataset is mentioned on this page.",
      "url": "https://arxiv.org/abs/2203.05797",
      "kind": "paper"
    },
    {
      "text": "Persona memory extraction methodology (e.g., annotation schema, inter-annotator agreement) is not described in the abstract.",
      "url": "https://arxiv.org/abs/2203.05797",
      "kind": "paper"
    }
  ]
}
